{
  "id": "hinds-head-chorley",
  "name": "Hinds Head",
  "category": "pub",
  "locale": {
    "key": "uk",
    "country": "GB",
    "language": "en-GB",
    "currency": "GBP",
    "contact_channel": "phone"
  },
  "address": "Preston Road Chorley",
  "contact": {
    "phone": "01257 792430",
    "whatsapp": null,
    "email": null,
    "messenger": "https://www.facebook.com/thehindsheadCR/"
  },
  "socials": [
    {
      "platform": "facebook",
      "url": "https://www.facebook.com/thehindsheadCR/",
      "active": null
    }
  ],
  "website": {
    "verdict": "none",
    "url": null
  },
  "qualification": {
    "score": 90,
    "evidence": [
      {
        "check": "web_search",
        "result": "18 unique results for 'Hinds Head Chorley, Lancashire, UK'",
        "url": null,
        "timestamp": "2026-07-05T15:09:06+00:00"
      },
      {
        "check": "contact:phone",
        "result": "'01257 792430' from search snippet",
        "url": "https://chorley-chorley.cylex-uk.co.uk/company/the-hinds-head-27764675.html",
        "timestamp": "2026-07-05T15:09:06+00:00"
      },
      {
        "check": "social:facebook",
        "result": "found: The Hinds Head at Charnock Richard | Chorley - Facebook",
        "url": "https://www.facebook.com/thehindsheadCR/",
        "timestamp": "2026-07-05T15:09:06+00:00"
      },
      {
        "check": "website_check",
        "result": "no candidate own-domain website in search results",
        "url": null,
        "timestamp": "2026-07-05T15:09:06+00:00"
      },
      {
        "check": "osm",
        "result": "OSM lists no website tag for this pub",
        "url": null,
        "timestamp": "2026-07-05T15:09:07+00:00"
      }
    ]
  },
  "status": "found",
  "created_at": "2026-07-05T15:09:06+00:00",
  "updated_at": "2026-07-05T15:09:06+00:00"
}