{
  "id": "the-talbot-chorley",
  "name": "The Talbot",
  "category": "pub",
  "locale": {
    "key": "uk",
    "country": "GB",
    "language": "en-GB",
    "currency": "GBP",
    "contact_channel": "phone"
  },
  "address": null,
  "contact": {
    "phone": "+44 125 722 1267",
    "whatsapp": null,
    "email": null,
    "messenger": "https://www.facebook.com/watch/?v=1458488345398172"
  },
  "socials": [
    {
      "platform": "facebook",
      "url": "https://www.facebook.com/watch/?v=1458488345398172",
      "active": null
    }
  ],
  "website": {
    "verdict": "none",
    "url": null
  },
  "qualification": {
    "score": 90,
    "evidence": [
      {
        "check": "web_search",
        "result": "16 unique results for 'The Talbot Chorley, Lancashire, UK'",
        "url": null,
        "timestamp": "2026-07-05T15:08:11+00:00"
      },
      {
        "check": "contact:phone",
        "result": "'+44 125 722 1267' from search snippet",
        "url": "https://publocation.uk/pubs/lancashire/chorley/the-talbot",
        "timestamp": "2026-07-05T15:08:11+00:00"
      },
      {
        "check": "social:facebook",
        "result": "found: The Talbot | Chorley - Facebook",
        "url": "https://www.facebook.com/thetalbotateuxton/past_hosted_events/",
        "timestamp": "2026-07-05T15:08:11+00:00"
      },
      {
        "check": "social:facebook",
        "result": "found: The Talbot on Reels | Facebook",
        "url": "https://www.facebook.com/watch/?v=1458488345398172",
        "timestamp": "2026-07-05T15:08:11+00:00"
      },
      {
        "check": "website_check",
        "result": "no candidate own-domain website in search results",
        "url": null,
        "timestamp": "2026-07-05T15:08:11+00:00"
      },
      {
        "check": "osm",
        "result": "OSM lists no website tag for this pub",
        "url": null,
        "timestamp": "2026-07-05T15:08:11+00:00"
      }
    ]
  },
  "status": "found",
  "created_at": "2026-07-05T15:08:11+00:00",
  "updated_at": "2026-07-05T15:08:11+00:00"
}